DrumVR,https://revuc-vii.devpost.com/submissions/89772-drumvr,Submitted (Gallery/Visible),Pending,,03/04/2018 10:51:11,"Inspiration

Drumming is fun

What it does

Allows you to drum even if you don't have drums

How I built it

Unreal Engine

Challenges I ran into

Failing on my original project 18 hours into the hackathon

Accomplishments that I'm proud of

Submitting anyway!

What I learned

It's not about what you made but what you learned!

What's next for DrumVR
","",,"","unreal-engine, c++",,University of Kentucky,0,801G-4,University of Kentucky,"",""
RevUC2018,https://revuc-vii.devpost.com/submissions/89776-revuc2018,Submitted (Gallery/Visible),Pending,,03/04/2018 10:55:56,"RevUC2018 
Code Name: Show Me Your Tunes

The goal was to create a twitter bot that could be tweeted at and return a Spotify playlist. In order to build this we used several APIs to get information between the two. The APIs were for Spotify, Twitter, and we used IBM's Watson to pull keywords from the person who tweeted at the bot.

In addition we have also set up a website to loosely track our progress towards our goal.
",https://github.com/ptallo/RevUC2018,,"Best Useless Hack, Best Domain Name from Domain.com",python,,University of Cincinnati,2,801C-1,Univerisity of Cincinnati,"",""
PhotoArcade,https://revuc-vii.devpost.com/submissions/89777-photoarcade,Submitted (Gallery/Visible),Pending,,03/04/2018 10:56:27,"PhotoArcade

Create old school games using your own photos.

Old school arcade games are awesome, but old school arcade games that use your own photos as maps are even better.

Photo arcade seeks to reproduce the feel retro video games with never ending variation in game-play variation provided by your own photo gallery.

By using python and kivy we aim to reach the widest possible audience. PhotoArcade will be able to run on OS X, Windows, Linux, Android, iOS, and Raspberry Pi.
",https://github.com/gyurgyma/PhotoArcade,,Best Useless Hack,"python, kivy",,University of Cincinnati,3,801A-4,University Of Cincinnati,"",""
Beacon-of-Hope,https://revuc-vii.devpost.com/submissions/89781-beacon-of-hope,Submitted (Gallery/Visible),Pending,,03/04/2018 10:58:33,"Inspiration

We were inspired to help those who face natural distasters.

What it does

It is an emergency tracking system designed to help people during natural disasters to better find help and assist others along the way.

How we built it

We created a database using Firebase to store the data from multiple different client apps. Each client app was programmed using Java and XML in android studio. 

Challenges we ran into

Learning how to implement Firebase into android apps; most of the team had to learn to program in Java and XML since they were used to programming in C++. We also had some problems getting the phone to record the GPS coordinates.

Accomplishments that we're proud of

That we over came our challenges to produce a working product, that works just like we planned. We are proud of the many things that we learned: Java, Javascript, how to use android studio, and how to implement Firebase. 

What we learned

Over the course of a very long night we learned how to integrate Firebase into android studio. After we crossed that hurdle we had to learn to work with Json trees in order to use the database we made with Firebase. We did manage to figure out how to import and export from the data base using Json trees and java objects. We also had a very hard time making the backend to maintain the database. We eventally thought of an out-of-the-box solution to solve the problem: we modified a copy of the client app to fill in for the back end of the server.

What's next for Beacon-of-Hope

We also plan to increase the efficiency of the backend of the database to better cycle out old data so the app can run faster and support more people. We also plan to increase the app versatilty making it more applicable and convenient during high stress situations.
",https://github.com/d3bird/Beacon-of-light,,JP Morgan Chase & Co. - Best Hack for Social Good,"java, javascript, xml, google-maps, firebase",,"Ohio State University, Ohio University - Main Campus",3,801-10,Ohio University,"",""
FluidDB,https://revuc-vii.devpost.com/submissions/89784-fluiddb,Submitted (Gallery/Visible),Pending,,03/04/2018 10:59:21,"FluidDB
",https://github.com/drewrip/FluidDB,,"JP Morgan Chase & Co. - Best Hack for Social Good, Fifth Third Bank - Best Fin Tech Solution, Best High School Hack, 8451 - Make the Customer's Life Easier","c++, python, c, json",,"",0,860D-4,Sycamore High School,"",""
Maxland,https://revuc-vii.devpost.com/submissions/89790-maxland,Submitted (Gallery/Visible),Pending,,03/04/2018 11:05:49,"Cincinnati's a big city, let's fill it with homes

Cincinnati currently has a large homeless while property for sale is pricing out would-be buyers.  This speculation harms all citizens of Cincinnati not showing the beauty and the vibrancy that Cincy has.
Let's solve this issue by bringing communities together and getting them housed. 

What it does

Maxland aims to give suggestions on what type of housing to place on the land in order to maximize residential use of the land.   This will help encourage the developmental use of the land and get more people in homes.  It displays the different types of homes with data points on the map, the value it has, and a suggested housing type improvement.

How we built it

Data:  Foreclosure data, home value data, and neighboorhood data came from Cincinnati's Open Data Hub and Hamilton County auditor's office
Data Science: Data Processing and development are done in Python library Pandas
Hardware: Integration with Amazon Alexa under AWS Lambda for serverless cloud architecture
Visualization: Map visualization was done in the Javascript library Leaflet.js, Javascript
Backend: Backend was done in Firebase

Challenges we ran into

Data integrity: Many datapoints lacked full information and were not in easily accessible locations from the auditor's office, and Cincinnati's Data Hub
Javascript coding: Many of us needed to learn or relearn Javascript and how to best code for it. 
Data integration and rendering: We needed a way to integrate asynchronous data and read files into Javascript and render the data to the map which consumed ample time to do so.

Accomplishments that we're proud of

Sourcing information from various government websites
Data processing and extracting data from auditor's website and Cincinnati's Data Hub using Pandas
Learning and improving on javascript skills
Amazon Alexa integration
Group working skills and project scoping

What we learned

Learned completely new languages: Node.js Javascript
Learned completely new technologies: Amazon Alexa, Firebase, Leaflet.js, Amazon AWS, Amazon Lambda, Pandas
Learned data processing and integration

What's next for Maxland

Integrate Amazon Alexa further into the data
Find the size of land and learn more on how to integrate that information into best recommendations
Bug and code improvement
","https://maxland-a79e2.firebaseapp.com/, https://maxlandcincy.com",https://www.youtube.com/watch?v=0AIlpm4srg8&feature=youtu.be,"JP Morgan Chase & Co. - Best Hack for Social Good, Best Education Hack, Best Useless Hack, TCS - Best Hardware Hack, Amazon Web Services - Best Use of AWS, Best Domain Name from Domain.com","javascript, firebase, amazon-web-services, amazon-alexa, pandas, python, leaflet.js",,"University of Cincinnati, University of Indianapolis, Ohio State University",3,860D-5,"University of Cincinnati, University of Indianapolis, The Ohio State University","",""
BinarySolVR,https://revuc-vii.devpost.com/submissions/89791-binarysolvr,Submitted (Gallery/Visible),Pending,,03/04/2018 11:06:11,"Inspiration : We wanted to make a game that also was able to be used by teachers for testing students.

What it does : It is a game that gives you a decimal number and you then have to change the switches in game to make it into a binary number. There are a total of 5 levels each with randomly generated numbers. Once the final level is beaten the win screen comes up.

How I built it : We built it using Unity & Visual Studio for the coding and logic. And for the trophy at the end and the room in the game we used Blender to create the objects.

Challenges I ran into : No one in our group had used Unity or Blender before and only one of us knew some C# which Unity uses as its coding language.

Accomplishments that I'm proud of : Getting the game working in 24 hours after not knowing how to do anything in unity or blender before we started the project. Getting it working in VR in a very short time.

What I learned : We learned how to use Unity and how to write logic in Unity using C# in Visual Studio.

What's next for BinarySolVR : Give it to teachers so they can have their students work with it and possibly test them using the game.
","",,"Best Education Hack, Best Domain Name from Domain.com","unity, blender, visual-studio",,University of Cincinnati,2,860B-7,University Of Cincinnati,Domain.com,Alienware Laptop and Oculus Rift
DashWall,https://revuc-vii.devpost.com/submissions/89797-dashwall,Submitted (Gallery/Visible),Pending,,03/04/2018 11:16:41,"IWishIWasACyb.org

Inspiration

We've attended hackathons before, but had never used microcontrollers before. We wanted to learn how to use these tools while creating something that we ourselves would use.

What it does

DashWall is a wall display with home diagnostics at-a-glance. It displays the time, and uses its sensors to determine the indoor temperature, sump pump water levels, and changes its brightness depending on ambient light levels.

How we built it

We built DashWall using Windows 10 IoT on a Qualcomm DragonBoard 410c, using a Microchip as a makeshift ADC to interface with our sensors.

Challenges we ran into

We ran into an issue with transferring data from the Microchip to the DragonBoard that remained unsolved for several hours, eventually being solved by the addition of a ground wire between the microcontrollers. This was definitely a lesson we won't forget when using microcontrollers in the future!

Accomplishments that we're proud of

We finished what we outlined in our MVP! Time display and sensor-driven temperature and adaptive brightness!

What we learned

DON'T FORGET THE GROUND.

What's next for DashWall

We're looking forward to integrating more sensors and helpful APIs for things like displaying todo lists and weather forecasts.
","",,"TCS - Best Hardware Hack, Best Domain Name from Domain.com, Best IoT Hack Using a Qualcomm Device","qualcomm, windows-10-iot",,University of Cincinnati,1,801C-5,University of Cincinnati,"","DragonBoard 410C, Grove Starter Kit Components, and Intel Starter Kit Components"
Simply Useless Simple Uses,https://revuc-vii.devpost.com/submissions/89798-simply-useless-simple-uses,Submitted (Gallery/Visible),Pending,,03/04/2018 11:17:05,"Inspiration

We're all three freshmen right now with a growing yet limited knowledge of coding. We wanted to branch out a little bit at RevolutionUC, so we decided that we wanted to take advantage of the 24 hours and learn HTML and website design.

What it does

Our program/website runs a variety of mini-programs that run amusing functions that do absolutely nothing.

How we built it

We started off writing our functions in C++, a language that we are all familiar with, then we researched how we can translate that into JavaScript.

Challenges we ran into

Going into this, none of us knew anything about how to design a website. We struggled with doing simple things and it felt like we were getting hurdle after hurdle thrown at us.

Accomplishments that we're proud of

We're very proud of what we've accomplished here. We have learned the basics of two different new languages that can be used in nearly any future profession.

What we learned

We've learned how to do basics in HTML formatting, JavaScript, and how to style using CSS
",http://simplyuselesssimpleuses.com.s3-website.us-east-2.amazonaws.com/,,"Best Useless Hack, Amazon Web Services - Best Use of AWS, Best Domain Name from Domain.com","html5, javascript, css",,Ohio University - Main Campus,1,801M-8,Ohio University,AWS and Domain.com,""
Mind The Gap,https://revuc-vii.devpost.com/submissions/89800-mind-the-gap,Submitted (Gallery/Visible),Pending,,03/04/2018 11:23:29,"Inspiration

We were inspired to create an app that would increase mindfulness and positivity. Oftentimes people get stressed and become negative through the busyness of life and the portrayal of the world through media. We wanted to build an app that would allow others to journal about what good happened to them today and what good they did that day. Users would then be able to view what others have written anonymously. 

What it does

It is an app that is connected to a database. Currently, all it does is allow the user to type in what they would like to write and then swipe to a page that would have what others have written. 

How we built it

We used React-Native to build this app. 

Challenges we ran into

Integrating with a database was a pain and took much of our time. The error messages presented on the screen were also not very informative as to what the problem was. 

Accomplishments that we're proud of

While we don't have much, we did learn how to create a basic application in React. This was overall a great ( and frustrating ;) ) learning experience. 

What's next for Mind The Gap

To have the database also syncs with a remote database and be able to have multiple users be able to see updates in real time. We would also like to work on the interface and have the design be more user friendly. 
",https://github.com/johnsonwe/mindthegap.git,,Best Useless Hack,"react-native, android",,Berea College,2,860B-2,Berea College,"",""
Satellite Chasers,https://revuc-vii.devpost.com/submissions/89803-satellite-chasers,Submitted (Gallery/Visible),Pending,,03/04/2018 11:24:04,"Inspiration

Each member of Satellite Chasers is a member of the UC CubeCats (http://uccubecats.org/), an undergraduate student organization dedicated to the education of members through the construction of Cube Satellites, and High Altitude Balloons. We wanted to learn more about antenna design, and construction and how satellite communication works. This will aid us in designing a ground station to communicate with our satellite Project Leopard that will be launched into Orbit within the next few years.

What it does

Our Omni-directional double cross antenna receives signals on the VHF frequency band at around 137 MHz. The antenna is constructed of steel cable, copper fittings, and COAX cable all made for under 35 dollars. 

How we built it

The antenna was constructed by mounting quarter wavelength steel dipoles on a wooden support structure and then connecting them to 4 coaxial cables that were then connected to a computer via SDR#.

Challenges we ran into

The largest challenge that the group overcame was adjusting the sampling rate of the system to that of each individual satellite that flew over. Furthermore the cross connection of the quarter wavelength steel dipole antennas and splitting of the coax cables was a challenge. There were no wire strippers available to strip, and disassemble 3/8"" coax cable so a new process had to be created to strip and separate the core and conductive shielding or the cable. 

Accomplishments that we're proud of

As a team we are proud that we were able to sample images from a NOAA weather satellite for under 35 dollars. The team worked extremely well together and was able to prototype and build the antenna within 12 hours of the start of the hackathon.

What we learned


How to calculate and design an antenna for proper gain of a desired frequency
How to use SDR# to trans-code images from an analog signal
How to decode a wav audio signal from a satellite into a static image


What's next for Satellite Chasers


Automation of a control system to sample satellites without a human user to initialize satellite contact (beacon signal for connection).
Apply the knowledge learned from the project towards the completion of the UC CubeCats ground station that will be used to communicate with satellites in Low Earth Orbit (LEO) over VHF and UHF frequency bands.
Design an antenna for use at higher frequencies and possibly communicate with Geo-Stationary Satellites

","",https://www.youtube.com/watch?v=55zyem2PHWg&feature=youtu.be,TCS - Best Hardware Hack,"hardware, wxtoimg, sdr#",,University of Cincinnati,3,801-7,University of Cincinnati,"",""
LowDiskReader,https://revuc-vii.devpost.com/submissions/89807-lowdiskreader,Submitted (Gallery/Visible),Pending,,03/04/2018 11:30:54,"Inspiration

I wanted to make software which does not have dependencies and the code i have is all the code.

What it does

It contains methods for printing text numbers and errors codes from disk reads.

How I built it

I used nasm to build it.

Challenges I ran into

The code ran into some errors that are unknown.

Accomplishments that I'm proud of

It runs pretty good

What I learned

I learning how to build a program on top on the x86 architecture independent from any libraries.

What's next for LowDiskReader

I want to rework the disk reading to work so i can work with more memory instead of working with the initial 512 bytes of memory. Then make a basic DOS OS with all basic library functions an OS has.
",https://github.com/ryoung9550/ucRevProject/blob/master/bootstrap.asm,,"",assembly,,University of Cincinnati,0,801C-2,University of Cincinnati,"",""
Heart Disease Risk Assessment,https://revuc-vii.devpost.com/submissions/89808-heart-disease-risk-assessment,Submitted (Gallery/Visible),Pending,,03/04/2018 11:31:04,"Inspiration

We are interested in machine learning and would like to pursue a career in ML or data science. Because of this, we decided to try implementing some sort of prediction model for a disease which is heavily influenced by certain lifestyle risk factors and could help early intervention in hospitals. We thought heart disease would be perfect for this purpose because it is the number one cause of death in the world and has many preventable factors.

What it does

It uses 270 samples (we could also incorporate an additional 303 which we have been using for testing) to train a model for heart disease prediction based on 13 different factors recorded on hospital admission. It provides an interface for health care providers to enter in data about the patient and obtain a suggestion of whether or not to consider screening/intervention.

How we built it

We used the markov learning network package _ tuffy _ to structure the first order logic of our world and the rules within it. We then tested on our expected weights, and got an accuracy of 67%. We used tuffy to reevaluate our weights and tested again to get an accuracy of 89% on the other 303 samples set aside for testing (we believe however that there may be significant crossover with the 270 sample dataset). Using a 5 k-fold cross-validation we obtained 80.7% accuracy. Finally we tried out a learning ensemble with 100 instances of randomly aggregated MLN models to obtain 82.6%. This was only slightly better than the cross-validation and took many hours to train, so we believe that using a learning ensemble with this problem is not enough gain for the cost. After doing these analyses of our data, we created a front-end to our functionality to allow a user to input health data and assess whether or not the individual is at risk and should take precautions/screening.

Challenges we ran into

It took us a lot of time to accurately model the data into a set of rules and weights and we needed to research and learn a lot about heart disease. In addition, we had to ensure the correctness of the dataset and make sure we fully understood each column. The learning ensemble was also a bit difficult to implement due to scalability reasons, which lead us to shift focus because it seemed impractical.
We also were unable to implement blood pressure because the data was possibly incorrect and negatively affected the accuracy. This is disappointing because blood pressure seems like it could be a very useful piece of information to predict heart disease.

Accomplishments that we're proud of

We were very pleased with the accuracy we were able to obtain. Over 80% was great to us and we believe it could possibly even be improved with more analysis.

What we learned

We learned about Markov Logic Networks, first order logic and learning ensembles, as well as the risks related to heart disease. We also each had different skill-sets coming in, so it was very helpful to learn off of each other instead of learning these things by the books.

What's next for Heart Disease Risk Assessment

The accuracy could possibly be improved by assessing the importance of each feature/predictor. We could also improve the running time by storing the models instead of generating them on runtime. We generate the model because the user can omit certain data in their query, in which case the model needs to be generated differently. We can get around this by storing every possible model and using that data instead of generating, because memory is relatively cheap.
","",,JP Morgan Chase & Co. - Best Hack for Social Good,"tuffy, python, bash",,Ohio University - Main Campus,1,860D-2,Ohio University,"",""
eyeRoom,https://revuc-vii.devpost.com/submissions/89809-eyeroom,Submitted (Gallery/Visible),Pending,,03/04/2018 11:33:02,"Inspiration

We're a part of our school's local ACM chapter. We have a club room that people hang out in during the day and into the night. It serves as a hangout spot, a study spot, and a club social outreach center. There's a problem when you have a large organization and a small room, though. Sometimes people come in wanting to study and find it jam packed full of people. Other times people come into the room expecting to hang out with their friends only to find the room empty! Sometimes members are only looking for specific other members while trying to avoid particular people. 

We decided an automated solution to this would save us some hassle.

What it does

Using opencv, running on a raspberry pi with a webcam, we capture images of a room and determine the number of individuals in the room. The image of the room and the meta data is then pushed to a firebase server. A telegram bot can be used to access the server and report to users the status of the room.

How we built it


opencv + raspberry pi w/ camera for image processing of the room.
firebase database for storage of data
python telegram bot for user interface


python-telegram-bot
pyerbase

dynamic webpage for user interface


html5
css
javascript
firebase



Challenges we ran into


Amazon lambda and Amazon Alexa skills turned out taking a longer time than expected to get working.
Compile time and network conditions slowed progress.


Accomplishments that we're proud of


We stack cups really well.
A health amount of code was finished within the first 12 hours, compile times delayed the remaining portions.


What we learned


Opportunity to work with new languages and packages.


What's next for eyeRoom


Integrate Alexa skills as another form of user interface.

","https://github.com/therobotcarlson/eyeRoom, https://github.com/therobotcarlson/eyeRoom/tree/gh-pages",,"Best Useless Hack, TCS - Best Hardware Hack, Amazon Web Services - Best Use of AWS","python, opencv, raspberry-pi, telegram, amazon-web-services, firebase, node.js",,University of Kentucky,3,801G-5,University of Kentucky,AWS,Amazon Echo
Electronic Music Maker,https://revuc-vii.devpost.com/submissions/89812-electronic-music-maker,Submitted (Gallery/Visible),Pending,,03/04/2018 11:36:40,"Electronic Music Maker

What it does

The Electronic Music Maker can make electronic music sounds that are used to create electronic music.  The interface for this is turning the knobs and buttons on the board.

How it works

There is an Arduino that is used to generate sounds and drive a speaker using PCM.  The sounds are generated by turning the knobs on the board. 

What the knobs do (from left to right)

1) Control frequency
2) Control delay in between notes
3) Control length of notes
4) Control range of frequencies.
",https://github.com/Tyler-Hilbert/Music-Maker,https://vimeo.com/258503035,"Best Useless Hack, TCS - Best Hardware Hack",arduino,,University of Cincinnati,0,801B-2,University of Cincinnati,"",""
Some Kind of Clock,https://revuc-vii.devpost.com/submissions/89813-some-kind-of-clock,Submitted (Gallery/Visible),Pending,,03/04/2018 11:38:18,"Inspiration

My group and I thought it would be fun to make an alarm clock that does more harm than good to the user

What it does

Not much right now, it's mostly just a clock

How I built it

Originally with C++ and a time library, but now with the Qt Framework

Challenges I ran into

Group issues, and obtaining the necessary building materials

Accomplishments that I'm proud of

Fixed a bug with Qt that prevented me from using it

What I learned

Pre-Planning a project with a group would've been a much better idea. I learned a lot about the groundwork of app/software development with a GUI

What's next for A Form of Clock

Probably the recycling bin, than learning more about the Framework that built it.
","",,"","c++, qt",,Ohio University - Main Campus,0,860B-4,Ohio University,"",""
