Secure Drawer,https://revuc-vii.devpost.com/submissions/89744-secure-drawer,Submitted (Gallery/Visible),Pending,,03/04/2018 10:06:44,"Inspiration

With most lock boxes, you need to use something like a key, RFID, or something else that you gotta keep track of to open the device.  

We wanted to make something that was effortless to get access to the secured box.  With Bluetooth Low Energy (BLE), we can auto unlock the box which makes for a convenient and secure device!

What it does

Our security drawer has many features to protect your stuff.  We have it locked with a servo.  If your phone is near the device (within a foot or two), it will automatically unlock the drawer and you can open it with ease.

However, if you are NOT an authorized user, the drawer will be locked.  If you try to pick up the box, an alarm to go off and there will be red lights flashing!  This will scare anyone trying to take the box.

How we built it

The drawer is made out of foam board and cardboard with an acrylic handle.  It has a servo on the inside to handle locking and unlocking.

Inside there is a board with several devices.  We have an Arduino pro mini that controls the LEDs and servo.  We also have a 9 degree of freedom sensor to measure force on the box.  In addition a BLE module is connected to be able to broadcast out to devices.

A service runs on an Android phone that periodically checks for the drawer.  If the drawer is nearby, it will start monitoring RSSI (signal strength).  Once close enough, the phone sends the unlock command and the drawer will open.  Once out of range, the drawer will lock.

Challenges we ran into

We ran out of wire and had to improvise a couple times.

We burned some stuff (only 2 fires this time!)

We shocked some stuff (but nothing actually broke!)

The BLE module purchased ended up actually being a cheap knockoff with very little functionality.  We had to rethink our method of attack to get the project to work.  We had to decompile someone elses Android application to figure out how to write our own to interface with the BLE device correctly.

Accomplishments that we're proud of

You can actually authenticate with your phone locked AND in your pocket.  It actually is a 0 effort solution!

What we learned

If you are working with an unknown BLE device, a BLE packet sniffer would be super helpful.

Bring enough wire for your project.

As always, hardware IS hard.

Zener diodes dont work well on data lines.

What's next for Secure Drawer

Upgrading to a drawer that you can't cut a hole in.

A smaller form factor for the device.  Ideally, we would like to be able to adapt it to any drawer.

Be wealthy enough to have valuable items to keep safe in our drawer.
","",https://youtu.be/_EFg5OU0XbE,TCS - Best Hardware Hack,"c++, arduino, android, java, bluetooth, ble, leds, foam-board, chinesium, raspberry-pi",,"University of Akron, Ohio State University",3,860D-3,"University of Akron, The Ohio State University","",""
Focus Friend,https://revuc-vii.devpost.com/submissions/89753-focus-friend,Submitted (Gallery/Visible),Pending,,03/04/2018 10:28:39,"Inspiration

In previous years at RevolutionUC, we have been enthralled by all the different hardware and we were determined to use the Muse brainwave-sensing headband this year. Therefore, we decided to center our project around a problem that we see in everyday life, and incorporating a solution that will be the most beneficial to the most users. 

ADHD is the single most common childhood disorder with nearly 11% of school age children having been diagnosed. As the cases in the country have incresed in the last few years, we decided it would be appropriate to look at this issue through a digital lens. 

Our Project

Our project leverages the Muse Headband to detect levels of gamma brain-wave activity, and creates a graphical display that allows patients to learn how to control their thought patterns through biofeedback. In biofeedback, an individual monitors a real-time display of a body mesurement and consciously makes an effort to change it. By exercising this way, they learn how to consciously control what would otherwise be an unconsciously controlled bodily function.

While biofeedback is clasically applied to physiological metrics like blood preasure and heart rate, bodily temperature, pain sensations, and so on, we decided to try biofeedback about the user's brainwave patterns themselves. Therefore, the user can learn to consciously control their brainwave activity, automatically leading to great control over counsciousness, focus, and alertness.

How it Works

The Muse headband uses four electrodes on the forehead and ears to detect voltage levels around them, in a technique known as an EEG. This raw data is interpreted by our wrapper for the muse-io application, which uses the OSC protocol to transmit data from the headset to any OSC-capable receiving API.

The program that receives the raw data is written in Python. We spawn a thread that listens for OSC messages and use a dispatcher to handle these events asynchronously. Then, we use a mathematical technique called a fast fourier transform to transform the raw signal from the time domain to the frequency domain-- decomposing the voltage/time graph into a breakdown of amplitude/frequency. From this result, we average those frequencies that are associated with gamma and beta waves, which represent conscious alertness and focus.

To provide user display, the value is displayed in an easy-to-understand graphical interface, which shows a horizontal colored meter that fills up proportional to the user's focus level, with high refresh rate and very low latency.

Challenges

One of the most challenging aspects of this project was the interface from the OSC protocol used by Muse to the Python application that we needed to use to process the data in real-time. Another challenge was creating the graphical output, as we ran into countless problems with mutli-threading and thread locking issues.

What we Learned

We learned how to use the Muse headband to accurately and quickly measure data about the brain as it functions. We learned how to connect with this device's software to extract the raw data in real time, and we learned how to pipe this data into a Python program.

We learned about signal processing with (Fast) Fourier Transforms, and explored the mathematical significance behind this immensely useful (and cool) process. We also learned how to create a live-updating graphical interface in Python, including all of the threading ""gotchas"" that go along with it.

But not only did we learn about data and programming, but building this project was a learning experience in other aspects, as well. Because our team was formed from two partnerships who hadn't worked together before, we learned a lot about how to balance and utilize each team member's strengths in working for the project. As we began working together and sharing fresh ideas and perspectives, our productivity massively increased and we were able to attack problems by using each person's ideas, knowledge, and past experience.

What's next for Focus Friend

Right now, Focus Friend is in the prototype/proof-of-concept stage. Our future plans include:
- Mobile support for Android and iOS
- A monitoring platform for parents and educators to monitor the focus levels and reports of their students
- Possible expansion of the technology to other applications, not just ADHD
",http://www.github.com/vasilescur/FocusFriend,,"Best Education Hack, Best High School Hack, TCS - Best Hardware Hack, 8451 - Make the Customer's Life Easier","python, muse, graphics, processing, osc, numpy",,Duke University,1,860D-1,"Loveland High School, University of Cincinnati","",Alienware Laptop and Muse Headband
Smart Cart,https://revuc-vii.devpost.com/submissions/89756-smart-cart,Submitted (Gallery/Visible),Pending,,03/04/2018 10:30:43,"Inspiration

We wanted to create a Full Stack integrated IoT product that bettered the Consumer Shopping Experience and provides more value to both customer and retailer.

What it does

Hardware unit is attached to a shopping cart and has a touchscreen display and a barcode scanner. Customer scans items and finds out if they're on sale, related items they might want and gets suggested recipes using the product. The store can track popular items/sales/etc, and the server/DB uses machine learning to track what items are being bought with what to continually improve it's recommendations.

How I built it

We have a raspberry pi that simulates the hardware components by taking 12 integer arrays representing UPC barcode values (i.e. 028400091565 = Lay's Classic Potato Chips 1.5 oz bag) since we didn't have a barcode scanner to work with, and it sends the value to a MySQL DB on an AWS cloud server, which identifies the product and checks its relation to other products. The DB uses machine learning in the background to find correlations between product sales to determine what items to recommend. It then sends the product data and related product information back to the Smart Car client device via a web interface with the GUI interface.

Challenges I ran into

We used the Raspberry Pi 3 instead of the Dragonboard 410c because the Dragonboard we checked out was non-functional, and no other working ones were available.

Accomplishments that I'm proud of

Our Full Stack work! We successfully were able to take data in from the Pi, process it in our cloud infrastructure and get the item to show up on the GUI with recommendations.

What I learned

As a team, we all learned new skills for each of our parts of the project. I hadn't ever used Python before, so I had to learn it as I went in order to take input from the keypad connected to the GPIO pins of the Raspberry Pi and push it to the database. Our Database Engineer learned how to create and use an AWS EC2 instance that hosts our database. Our GUI designer learned to use the Flask web service API. Overall we learned a lot about IoT. 

What's next for Smart Cart

Integration with customer loyalty programs (such a Kroger Card, for example) that allows the cart to display a custom shopping list tied to the customer, tailor recommended products to the individual customer based not only on overall trends but their personal purchase history, display coupons connected with the card, etc. 

Potentially, Smart Cart 2.0 could use sensors to detect the products in the cart and could automatically charge a customers account when the leave the store without having to stop at a checkout line, similarly to Amazon Go.
",https://www.shopwithsmartcart.com,,"TCS - Best Hardware Hack, 8451 - Make the Customer's Life Easier, Amazon Web Services - Best Use of AWS, Best Domain Name from Domain.com, Best IoT Hack Using a Qualcomm Device","raspberry-pi, python, html, css, bootstrap, javascript, amazon-web-services, flask, mysql, amazon-ec2, amazon-rds-relational-database-service, machine-learning, jquery, socket.io, keypad, touchscreen",,"University of Louisville, Northern Kentucky University, University of Cincinnati",3,801C-4,"University of Louisville, University of Cincinnati, Northern Kentucky University",AWS,DragonBoard 410C
Nanohack,https://revuc-vii.devpost.com/submissions/89758-nanohack,Submitted (Gallery/Visible),Pending,,03/04/2018 10:34:26,"Inspiration

Nanohack was inspired by the want to make hackathons more prevalent in the industry. If you make a game about it, people will come.

What it does

It captures the idea and theme of a hackathon and presents it in a fun adventure that anyone can enjoy!

How we built it

We used Gamemaker Studio as our game engine. This is what was used to really put everything together. Beepbox and Audacity were used for music and sounds. Aesprite was used for the visual assets.

Challenges we ran into

The timing of everything was honestly our biggest challenge. When making a video game there are many aspects to be considered like programming, music, sounds, sprites and animation. Squeezing all of this into a 24 hour period with only 4 people is very challenging.

Accomplishments that we're proud of

We feel like we've done really well in the time management of our project. There are obviously more things we'd like to do with the game but some sacrifices had to be made to make sure the general idea got across in our short amount of time.

What we learned

I think we learned a lot about time management, project management and just general communication between a small team.

What's next for Nanohack

We have a wait list of ideas for the game that had to be put on hold due to the time constraint of a hackathon. We'd love to implement these ideas and add more levels to make this a more fully featured game that spreads the concept of hackathons far and wide!
",https://github.com/navett52/Nanohack.gmx,,"","gamemaker-studio, aesprite, audacity, beepbox",,"Northern Kentucky University, University of Cincinnati",3,801M-1,"NKU, UC","",""
The Thingamagig,https://revuc-vii.devpost.com/submissions/89759-the-thingamagig,Submitted (Gallery/Visible),Pending,,03/04/2018 10:36:20,"Inspiration

We wanted to make the most useless hardware hack here

What it does

Nothing of use. It plays the Mario theme on a buzzer after the rfid card scanner counter reaches a certain level then resets. The counter data is also passed to a pocketchip that then transmits that data over LoRa.

How we built it

Took as much hardware as we could get our hands on and we threw it together in a machine that does stuff and things. 

Challenges we ran into

We ran out of pins for a hot seconds then we found another uno to use

Accomplishments that we're proud of

We got it too play Mario theme and transmit over RF's

What we learned

How to use RFID technology and SDR technology

What's next for The Thingamagig

Get broken down and returned. 
","",,"Best Education Hack, Best Useless Hack","arduino, sdr, pocketchip, sensors, rfid",,Ohio University - Main Campus,0,860D-2,Ohio University,"",Grove Starter Kit Components
Snapsey,https://revuc-vii.devpost.com/submissions/89766-snapsey,Submitted (Gallery/Visible),Pending,,03/04/2018 10:45:50,"Inspiration

Our Inspiration for Snapsey are the image to text converters which we felt could be extended to provide more functionality.

What it does

Snapsey first prompts the user to take a picture of a food product, then the product name and important nutrition info is given to the user in their native language that they have selected

How we built it

We built Snapsey by integrating Google's Cloud Vision API which converts the picture to the product name, the Nutritionix API which gets the nutrition information for the product, and Google's Translate API which translates the product name and nutrition information together within Android Studio.

Challenges we ran into

One of the main challenges we ran into was working with Gradle which proved to be difficult to manage and get functioning.

Accomplishments that we're proud of

Working from having no experience with Android Studio and Google API's to producing a working
application with them.

What we learned

We learned a lot about Android development as well as using API's

What's next for Snapsey

Some features we could implement into Snapsey in the future include providing pricing information as well as locations where the product can be purchased.
",https://github.com/ctooley21/Snapsey,,"JP Morgan Chase & Co. - Best Hack for Social Good, TCS - Best Hardware Hack, 8451 - Make the Customer's Life Easier","google-vision, google-translate, nutritionix, android-studio, java",,University of Kentucky,2,801M-5,University of Kentucky,"",""
LaserCubes,https://revuc-vii.devpost.com/submissions/89767-lasercubes,Submitted (Gallery/Visible),Pending,,03/04/2018 10:46:59,"Inspiration

The world needed a new way to interact online

What it does

Move around in front of your camera and explore CUBE WORLD

How we built it

We used a face tracking library and three.js to make a 3d virtual world you can play in with your friends

Challenges we ran into

The camera library was poorly documented so we had to hack it up to get something working quickly.
The networking needed to make live online games is tricky, we're doing it for the first time. None of us have programmed in golang before so the decision to use it was a folly, but it worked out well in the end.

Accomplishments that we're proud of

It really works. It works on a cell phone, too.

What we learned

We learned to use three.js to make cool 3d games, how to do client-server interactions, and a quick dive into golang for servers.

What's next for LaserCubes

Replace AJAX with WebSockets so it's faster. 
",https://cubelasers.com,,"","javascript, golang, webgl, vim, aws-lightsail",,"University of Louisville, University of Kentucky",1,801-3,"University of Kentucky, University of Louisville","",""
ApperceptionVR,https://revuc-vii.devpost.com/submissions/89768-apperceptionvr,Submitted (Gallery/Visible),Pending,,03/04/2018 10:47:30,"Inspiration

It would be hard to find someone who hasn't taken a personality test (i.e. Meyers Briggs, DISC assessment, Big Five personality tests, etc.). The problem is that the vast majority of these tests are not evidence-based and lack any predictive power. Also, people are often given these tests under high-stakes (job interview process) and are incentivized to modify their responses to fit into a certain group. To cut through the noise, we wanted to build personality profiles based on initial, gut reactions to simulated situations using VR.

What it does

Jump into a series of curated VR situations aimed at understanding your initial, gut reactions to difficult and ethical situations. While you are immersed, we are measuring a multitude of performance metrics! Our goal is to have around 10 fast-paced experiences that cover topics ranging from stress management, adaptability, creativity, problem solving, and philosophy. Over the past 24 hrs, we built two highly-polished scenarios to test the concept.

Target audience

We imagine that while this tool provides value, the initial investment in the VR setup is high. As a result, our target audience at first would be organizations (businesses, non-profits, military, law enforcement, government).

How we built it

Game engine: Unreal Engine 4

Using C++ scripts attached to Unreal, we were able to record performance metrics during the experience.

3D modeling: 3DS Max

Texturing: Substance Painter

VR headset: HTC Vive

Challenges we ran into

We wanted to collect biofeedback information such as respiratory rate or heart rate in addition to in-game performance metrics. We did a deep dive on heart rate using optical sensors, EKG breakout boards, and even tried to reverse engineer a pulse oximeter. In the end, we ran out of time on integrating biofeedback, but we learned a lot in the process!

Accomplishments that we are proud of


Amount of data that we were able to collect
The insights that we gathered
Examined data from 40 individuals
The amount of work that we were able to complete
Being able to collaboratively work to develop a strong idea
Utilizing VR as a predictive tool for personality tests


What we learned

VR


How to correct for visual anomalies that occur in VR, such as spacial awareness
How to record performance in real-time in Unreal Engine
That VR can be a powerful tool for organizations that goes beyond its initial novelty and hype-factor


Biosensing


That optical pulse sensor is susceptible to motion artifacts
Typical 3 lead EKG sensors do not allow for freedom of motion either


Usability testing


People's reactions vary greatly to physiological and psychological tasks
What measurements would be valuable for feedback in next generations


What's next for ApperceptionVR


Adding biofeedback (heart rate and/or respiratory rate)
Building out a set of validated and curated situations (~10)
Measure interpersonal metrics by enabling multiplayer support
Record verbal reaction to tasks
Watch eye movement
Record extraneous movements of the limbs
Record task speed

","",https://youtu.be/JhiSf9KWqCw,"JP Morgan Chase & Co. - Best Hack for Social Good, TCS - Best Hardware Hack","unreal-engine, c++, htc-vive",,University of Cincinnati,3,801E-1,University of Cincinnati,"",""
Cara,https://revuc-vii.devpost.com/submissions/89770-cara,Submitted (Gallery/Visible),Pending,,03/04/2018 10:50:37,"Inspiration

Passwords are too complicated. Though we'd never compromise our security for financial accounts and other important systems, the fact is it is _ simply too annoying _ to type in a username and password to play video games or submit your math homework. With facial recognition on the rise as a new form of authentication, we felt it was still a rather exclusive feature - often reserved for expensive phones and laptops. We decided to build Cara - the facial recognition platform for everyone.

What it does

Cara is simple - it's a service that offers a drop-in solution for facial authentication. Any app or website can incorporate Cara into their service with ease - all the difficult bits are abstracted away by the robust yet secure technology hiding behind Cara's servers. The idea is to bring the power of this new technology to everyone - from aspiring startups trying to get their products off the ground to freelance developers looking for a way to differentiate themselves from the crowd. In order to prove Cara's widespread applications, we built a series of demos incorporating Cara in different aspects, proving its worth within the family, the education system, and the industry at large.

Family

Dementia and Alzheimer's are terrible to experience - both as the victim and his/her family. Though Cara can't solve major breakthroughs in medical technology, we can help mitigate the memory-related symptoms of these diseases. Cara can be used on AR devices to help patients of dementia or Alzheimer's remember who they're talking to. With the press of a button, Cara will recognize the person in front of you and pull up helpful information about them - such as their name, the last time you've seen them, and where they work. With the power of technology, we can transform the last moments of our elders into memorable experiences rather than painful ones.

Education

""Can anyone tell me who's absent today?"" - a common question repeated across the world every morning in thousands of high school classrooms, Cara can solve this too. Using a simple camera setup in front of every classroom doorway, taking attendance manually becomes a relic of the past. As students filter into the classroom, all they have to do to be marked ""present"" is to tap a screen and wait to be recognized. However, Cara extends beyond simple attendance taking - with a curious mix of psychology and technology, Cara can recognize the emotions permeating a face. In combination with observing facial angles, Cara makes it possible to tell who's paying attention in class - and how they're feeling about it. Teachers can use this feedback to improve their lessons, as well as watch out for under-performing students.

Industry

Lastly, we decided to tackle a problem in the industry - the slowness of employee clock systems. Swiping a time-card or scanning a tag is boring - facial recognition is cool. With Cara, these systems can be easily replaced to be quick and painless. Times are automatically logged between clock-ins and clock-outs, ensuring the integrity of both employees and managers. 

How we built it

At the core of Cara lies Microsoft's Cognitive Services API, providing quick and secure facial recognition routes. Because no images are ever stored on a server, malicious actors that gain access to Cara's data would only encounter useless strings of letters and numbers that represent faces. Aside from Cognitive Services, our back-end is powered by a single Amazon AWS EC2 instance, while a custom-written hand-made API handles interactions between the user and the authentication services. 

Challenges we ran into

One unique issue we encountered was intercommunication between our servers. For some reason, the way the UC network is built disallowed devices from communicating with each other. In order to mitigate this, we decided to move all of our servers to cloud services - dispersing across AWS and Cloud9. On the development side, our seasoned back-end development time found challenges in designing captivating yet concise user interfaces that maintained their look across multiple devices.

Accomplishments that we're proud of

As a group of friends first and foremost, our proudest accomplishment at any hackathon is working together as a team to get closer to our goal - succeeding together, but also failing together. More than the prizes, it's about pushing technology to its limits while continuing to foster a learning environment for everyone.

What's next for Cara

We feel Cara has a bright future - as facial recognition makes its appearance in top-end technologies like the iPhone X, it's only a matter of time before it appears in more and more areas. We plan to be there - ushering in a new age of biometric authentication for small businesses, huge corporations, solo developers, and your grandmother.
","https://github.com/All-Hackathon-Projects/Cara, https://faceinthe.space",,"JP Morgan Chase & Co. - Best Hack for Social Good, Best Education Hack, Best High School Hack, 8451 - Make the Customer's Life Easier, Amazon Web Services - Best Use of AWS, Best Domain Name from Domain.com","microsoft-cognitive-services, amazon-web-services, node.js, express.js, bootstrap, love",,University of Illinois at Urbana-Champaign,3,860D-1,Adlai E. Stevenson High School,"",""
