Mission Im-pastable,https://revuc-ix.devpost.com/submissions/143096-mission-im-pastable,Submitted (Gallery/Visible),Pending,,02/23/2020 11:32:39,"Inspiration

In making when Mission Impastable, we were inspired by phone-controlled party games like Jackbox Party pack, and rogue-like games like Enter the Gungeon. We were hoping to bring together some of the best parts of those games/genres.

What it does

Mission Impastable is a working game, in which one user plays as the Pasta-mancer in a dungeon-crawling adventure. Audience users can connect to the game and interact with it by voting on how to help/hinder Player 1. The base game is built in Unity, and it interacts with ReactJS, Firebase, and a REST API in order to enable audience participation.

How we built it

We built a Python/Flask Rest API and a Unity game, wrapping them together with C# hooks. We used Firebase for API storage. 

Challenges we ran into

None of us have ever made a Rest API like this! We made a huge project, with a lot of interlocking parts, and this led to a lot of problems. Not to mention, this was one of our team members' first Hackathon!

Accomplishments that we're proud of

We were able to make a fully functioning game, which decently resembles what we were planning to make! All of our interlocking parts have been functioning, and we've made a really cool project!

What we learned

We've learned a lot about how to create and use Rest APIs, and also learned a ton about networking in Unity! Most of us also learned about React and Javascript for the first time!

What's next for Mission Im-pastable

The jump to 3D with a similar game would be an awesome next step!
","",,"Best Design Hack, Most Innovative Hack by UC Students (EECS GSA),  Best use of Google Cloud (MLH), Best Domain Registered with Domain.com (MLH)","unity, firebase, react, flask, rest, csharp, javascript, css, github, google-cloud, piskel, inkscape, modbox, beepbox, domain.com",,University of Cincinnati,3,801-3,University of Cincinnati,pastabox.online,"",Domain.com
Bryn-5/3,https://revuc-ix.devpost.com/submissions/143101-bryn-5-3,Submitted (Gallery/Visible),Pending,,02/23/2020 11:40:29,"Inspiration

Helping others to visualize their spending habits through some real-world interaction (spending/location monitoring)

What it does

Displays spending data (% of amount spent in a month at a location, monetary amount spent per month, locations of spending) on a mobile-accessible website. The locations are displayed on an embedded map and data has graphical elements to aid in understanding.

How we built it

Initially, the program was intended to be built using Angular, but the idea shifted after discovering the ease of deploying apps using NativeScript. NativeScript was used to build a standalone mobile app, but was scrapped and redesigned using HTML, and jQuery due to challenges with implementing a map API.

Challenges we ran into

Being complete novices to using typescript, we could not initially get dev tools to work when deploying our app and could not access the console log for debugging for several hours. After this was sorted, we ran into significant trouble formatting a Google map API from Google Cloud. Whenever the map and the user interface we had designed were attempted to be used together, the program crashed. After several hours of this, we resorted to using HTML instead of XML, as our team had more experience using Bootstrap for page design.

Accomplishments that we're proud of

Despite having never used typescript and never developing a mobile app before, we were able to successfully deploy several debugging and prototyping apps to both iOS and Android devices. Additionally, considering we totally redesigned our implementation of our idea with only 6 hours of hacking time remaining, we're proud of what we were able to improve upon in that time.

What we learned

We learned a great deal about typescript and web app development, and were able to implement some of the most advanced UI features we had ever attempted in this endeavor. We also learned quite a lot about using chartJS and enjoyed being able to think about ways into implement reality with banking software.

What's next for Bryn-5/3 (Location-oriented spending tracker)

In the future, we would like to implement an automated reporting of spending at various locations through a sort of API with a bank.
",https://www.glassestocsharp.com/hack/ucrevolution20/bryn/index.html,,"Best Education Hack, Best Design Hack, Best Use of Immersive Technologies to Enable Consumer Financial Health (Fifth Third)","jquery, nativescript, javascript, html, xml, typescript",,Ohio State University,1,801-2,Ohio State University,"","",Google Cloud
OutreachSheet,https://revuc-ix.devpost.com/submissions/143105-outreachsheet,Submitted (Gallery/Visible),Pending,,02/23/2020 11:43:40,"Inspiration

As a leading Co-Convenor of Earlham Hackers Club, Joseph used Facebook as an outreach platform to communicate with his club members. However, he didn't like the idea of having to open multiple tabs to send messages to all his members. Since he likes to add a personalized touch to his messages, he wanted a web-based application that allows him to send personalized messages more quickly and conveniently. After coming to RevolutionUC, he came up with an idea to make his convenor life more convenient. Dipesh decided to help Joseph in his journey. After 24 hours of awesomeness, they come up with an OutreachSheet. 

What it does

It sends outreach messages to Facebook chat from Google Sheets and vice-versa.

How we built it

In 3 phases, we integrated messenger and sheets. We first finished a Pandas enabled program with no function content at all. All we had was a bare-bones structure. From there, we learned and applied the fb chat module in a 2 fold custom data structure to connect Facebook to our program's data housing. We chose to develop the connection that carries data between Google first because that seemed very intricate and we were scared of the Google Sheets API. We finished the connection between Google Sheets and Facebook, and then we learned the Google Sheets API, developed a 3 fold custom data structure to connect our program's data housing with Google Sheets. 
We learned and applied the fbchat module to interface with messages from facebook, scaffolded our program plugged it.

Challenges We ran into

Google Sheets API integration took lot of our time. Thanks to Mentors for helping us out.
The front end was hard to do.
 Google sheets have a maximum write limit that we were not aware of.
We used many modules which made us do more debugging.

Accomplishments that We're proud of

Just getting through the bulk of the program was an accomplishment. The working code was like 400+ lines. In like 20 hours that's not bad at all. We also finally learned FB chat API, and the google sheets API, which is both super good and useful tools. We learned a lot during this 24-hours, and we are happy with the outcome.

What I learned

API integration, OOP, Pandas

What's next for OutreachSheet

We plan to add more functionalities, address all the small bugs, and work on the design. Also, Joseph plans to use OutreachSheet to communicate with his club members. Yayy.
",https://github.com/IS1-4MJ/Fb_sheets_chat_app,,"Most Innovative Hack by UC Students (EECS GSA),  Best use of Google Cloud (MLH), Best Data Collection Hack (CincyTech)","google-sheets-api, python, pandas, fbchat, google-sheets, gspread",,Earlham College,1,860D-2,Earlham College,"","",""
BeeBeeMath,https://revuc-ix.devpost.com/submissions/143106-beebeemath,Submitted (Gallery/Visible),Pending,,02/23/2020 11:43:40,"Inspiration

We are passionate about children's education.

What it does

BeeBeeMath is an online math education platform designed to assist kindergarten teachers in educating kindergarteners basic math concepts. It serves as an in-class tool for the teachers to help kids learn and fully grasp the fundamentals of math.

How we built it

We used the React framework and Material-UI Kit to build this product.

Challenges we ran into

We ran into some design problems and some minor technical problems during development. 

Accomplishments that we're proud of

We have a pretty neat design and product. It works well for its target audience.

What we learned

We've strengthened our understanding of React and grasped a pretty good comprehension of the Material UI Kit for React.

What's next for BeeBeeMath

We will continue to add more fun math topics and interactive lessons. We could possibly expand to more subjects such as reading, history, geography, etc.
",https://beebeemath.firebaseapp.com/?,,"Best Education Hack, Best Design Hack","react, material-ui",,Earlham College,1,860D-2,Earlham College,"","",""
travelingShopper,https://revuc-ix.devpost.com/submissions/143110-travelingshopper,Submitted (Gallery/Visible),Pending,,02/23/2020 11:48:29,"We as consumers often do not realize some of the inconveniences that we face while shopping because we have become so accustomed to them. Attending this hackathon and getting to know different challenges inspired us to think outside of the box; we brainstormed on our past experiences shopping at Kroger or any other retail markets and the ways we would be able to make them better for the future of us and others. 
Although all of our group members have past experience with some software development, we wanted to branch out and try to incorporate libraries and practices that we had no experience with to create our application. We have experience with Python, JavaScript, HTML, CSS, and SQL but we tried working with Vue.js, Vuetify.js, and API calls to create our travelingShopper application. Close to the end of the process, we decided to try and incorporate AdobeXD to showcase a prototype of our design process. We used this software because we were not able to finish as much as the project as we would have liked, but we still wanted to have something to showcase for the purposes of this Hackathon challenge. 
We started this process by looking into the Kroger's APIs to see if we could actually use the available public data for our application. Once we were sure the APIs would work in our favor, we split into two pair programming teams with one team taking on the backend with the API calls, and the other team taking on the UI creation with Vue.js. We used Vue.js to develop a prototype of an app that allows customers to input their items into their virtual cart. Our app gives them an eagle eye view showing them where their items are, and what item to get next to ensure the quickest shopping experience.
Challenges:Throughout the hackathon experience, we learned a lot about restful APIs, working in an MVC environment, and collaborating better as a team. I think we can take a lot of these concepts and apply them in our next hackathon, or a future business venture.
We think the biggest challenges was the fact that there was a steep learning curve with our entire process. Since we were trying to use new technologies, we were trying to learn the best practices and the documentations on the fly which made it challenging for our team. For the front end, we wanted to use a datatable to populate data dynamically using the JSON data we got back from our API calls. We were able to create a datatable and populate it with hard coded data, but we were not able to bridge the gap and find a way to populate it dynamically. On the backend, we needed to generate a new token key every fifteen minutes because it would time out. We were not able to create a dynamic call to make a new token key every time, so we hardcoded the token key and changed it every fifteen minutes. 
","https://github.com/grrdsoto/travelingshopper, https://xd.adobe.com/view/fa36a1a7-d850-4247-7e59-9d51d428216f-8c07/?fullscreen",,"Best Design Hack, Make the Customer’s Life Easier (84.51)","vue, html, javascript",,Berea College,3,"801E,-2",Berea college,"","",""
Geographical quiz ,https://revuc-ix.devpost.com/submissions/143111-geographical-quiz,Submitted (Gallery/Visible),Pending,,02/23/2020 11:49:11,"Inspiration

I like geography

What it does

It generate geographical quiz automatically and save your scores based on achievement

How I built it

I used Flask and Python for backend, HTML and CSS for front end. I also used SQLite for database

Challenges I ran into

KeyError

Accomplishments that I'm proud of

Be able to wake up all night to work

What I learned

GitHub is hard

What's next for Geographical quiz

We will try to fix all errors
",https://github.com/gianghta/RevUC-Quiz-App,,"","python, html, css, flask, jinja",,University of Cincinnati,2,860D-4,University of CIncinnati,"",Google Home,""
Minecraft Discord Bot,https://revuc-ix.devpost.com/submissions/143113-minecraft-discord-bot,Submitted (Gallery/Visible),Pending,,02/23/2020 11:49:20,"Inspiration

We spend a lot of time playing Minecraft and the old bot that we used just wasn't cutting it. When players got off the server, the EC2 instance shut down. This was fine, but players weren't held accountable for the time they spent on the server, and we wanted this to change.

What it does

When a player joins the server, they have their own personal collection of tokens (currency) that is deducted from as the user is on the server. It is deducted at a rate of 1 credit per minute. If the user runs out of tokens, they are bombarded with TNT in order to keep them from playing until they pay to be on the server. They can use the discord bot in order to check how many credits they have. If the bot joins another discord server, they credits are persisted between servers because of our usage of Cloud SQL.

How I built it

The server is built upon the Google Kubernetes Engine in order to make deploying as simple as possible. Things like our discord bot and our API server are running on Kubernetes. But, our minecraft servers themselves are also running up in the cluster! In order to persist data, we use Google Cloud Sql to persist data about our users and credits. We also wanted to play around with big data, so we implemented Google's BigQuery to store every time a block is broken.

Challenges I ran into

We did not know how to create a Bukkit plugin, and we did not know much about google cloud. One of the team members was familiar with AWS, so we had that as a starting point. We had to work with load balancers, kubernetes, Google's hosted nodes and BigQuery. We had a lot of issues in the beginning in getting our applications posted and deployed on the servers. After a while, we got some scripts running to get our application hosted. Creating an HTTP POST request in Java was an enormous hurdle as well. None of us knew Java so we had to do a lot of research in order to figure out what to do. We all learned a ton in the process.

Accomplishments that I'm proud of

The moment that we got our Java plugin to communicate with our NodeJS backend, we were extremely proud. We had issues getting the proper information to POST to the server because of the way Java handles the input. The issue was that we had to include the ""Content-Type"": ""application/json"" header.

What I learned

We learned how to make a plugin for Minecraft servers. None of us knew how to code in Java, let alone work on a plugin for a pre-existing server. We have learned so much and are extremely excited to use this knowledge to create plugins in the future.

What's next for Minecraft Discord Bot

We are extremely excited to actually implement this bot, so we want to continue working on it to make it fully polished and able to be used. We all enjoy playing with each other, and removing the need to manage server payments will be a huge help!
",https://github.com/OhioUniversityRevUC2020,, Best use of Google Cloud (MLH),"typescript, discord, google-bigquery, google-kubernetes-engine, google-cloud-sql, java, spigot",,Ohio University - Main Campus,4,801M-3,Ohio University,"","",Google Cloud
Hearthclone,https://revuc-ix.devpost.com/submissions/143114-hearthclone,Submitted (Gallery/Visible),Pending,,02/23/2020 11:49:38,"Inspiration

Wanted to get some experience in making a project that was our own.

What it does

Plays a card game

How I built it

Challenges I ran into

Accomplishments that I'm proud of

What I learned

What's next for Hearthclone
","",,"",python,,University of Cincinnati,0,801A-2,University of Cincinnati,"","",""
Buyers Guide Simplified,https://revuc-ix.devpost.com/submissions/143115-buyers-guide-simplified,Submitted (Gallery/Visible),Pending,,02/23/2020 11:50:31,"Inspiration

A few months ago, I was shopping for a used car and I noticed that the buyers guides had a specific formatting to them. 
It can be tedious to research a car manually, plus one should want to be discreet and into show to much interest in the car they want. 

What it does

I had the idea to make an app where you take a picture of the buyers guide and it pulls up the cars history report.
Alternatively, you can manually input the vin number to pull up the report.

How I built it

OpenCV to detect the edges of the buyers guide and transform the picture into a scan of the document.
TesseractOCR to extract text from the scan.
Flask to make the program web accessible.

Challenges I ran into

OCR is pretty garbage. Characters can be confused when scanning a document especially with there is glare and noise in the image. 
Finding a free and open source car history report lookup. In the end, I just made an example page. 

What I learned

Learning more about image transforms in OpenCV.
Winning Presentation Karaoke and a round of CTF.

What's next for Buyers Guide Simplified

Implementing an actual VIN Number Lookup
Ad revenue.
Prettier interface.
",http://opencvplusocrcanputthevinnumberfromthebuyersguideinforyouandsearchesfortheitshistoryreport.online,,"Best Domain Registered with Domain.com (MLH), Make the Customer’s Life Easier (84.51)","opencv, ocr, python, flask, love",,"",0,801C-1,"Berea College, University of Kentucky",opencvplusocrputsthevinnumberfromthebuyersguideinforyouandsearchesfortheitshistoryreport.online,"",Domain.com
Nutrition on a Budget,https://revuc-ix.devpost.com/submissions/143117-nutrition-on-a-budget,Submitted (Gallery/Visible),Pending,,02/23/2020 11:50:34,"Inspiration

As a college student, I find myself constantly trying to maximize all of my resources. This semester I am taking my first economics class which has really shifted my attention toward analyzing the marginal utility of my decisions. I wanted to see if there was correlation between cost of food and its calorie content, two variables that I try to keep low. The goal was to create a product that would make finding cheaper, healthier food more accessible for college kids like me and all shoppers at Kroger. 

What it does

What the app does and what it was supposed to do are slightly different. I wanted to create a visual representation of the ratio between cost and calorie content of different foods, however I quickly realized that I was trying to compare apples and oranges. I wanted to provide a series of charts on a simple, user friendly mobile app to show shoppers the percent cost of one item in terms of dollars and calories. 

How I built it

I used Android studio to build a simple form where a user can input their calorie goal and their budget goal. I user a GitHub library called Hellocharts-Android to create pie charts to represent the data. I also used a SQLite database to organize a sample of food items that the average customer would purchase. This included the name of the item, its calorie content on the margin, and its cost on the margin. 

Challenges I ran into

I have never done android development before, so I was introduced to a litany of new experiences last night, including Gradle build errors, Android dependency errors, and having to learn about everything from XML attributes to Activities to ViewModels. I was very overwhelmed at first and this seemingly simple project took me far more work that I care to admit. I also didn't completely end up with all of the functionalities or as clean of an interface as I was hoping for.

Accomplishments that I'm proud of

I have something to submit. I learned a whole lot, and I really got the chance to dive into a subject that could be useful to me in the future. I also took my other interests into consideration when ideating and was interested in the outcome of my project as a whole, and not just the technical aspects. 

What I learned

I learned how to navigate Android studio. I learned about Android build files, Android file hierarchy and structure, SQLite databases within Android Studio, embedding graphics in an app, creating emulators and other virtual devices, as well as how to better use my mistakes to my advantage.

What's next for Nutrition on a Budget

In a perfect world, there app would have options for organizing data based on different calorie goals and budgets, where I would be able to do more than display a pie chart. I also want to show more nutrition information and take into account sale prices or deals that shoppers at Kroger would use.

The GitHub link is not up to date because my teammate who quit owns the repo and has not merged my branch
",https://github.com/Suebi/NutritionOnABudget,,Make the Customer’s Life Easier (84.51),"android-studio, sqlite",,"",0,801G-1,University of Cincinnati,"","",""
Money Moves,https://revuc-ix.devpost.com/submissions/143120-money-moves,Submitted (Gallery/Visible),Pending,,02/23/2020 11:51:52,"Inspiration

One of our key weakness as a people is our inability to quantify how much saving money can change our lives. In order to help people better comprehend how much saving a few dollars per month can affect their lives we set out to create an application that would let them see how much further their dollar can take them.

What it does

Our app allows people to visualize their savings by allowing them to input their individual deposits or income flow and showing how saving that amount will grow in a set amount of years. Once the user submits their deposit, how often it is transferred, and how many years in the future they would like to visualize we display their total savings as a trail of money on the ground which they can then follow to see how far their money will take them.

How we built it

Our group used a variety of technologies specifically ARCore as our framework to developed an AR enabled android application. Unlike most Drag and Drop solutions ARCore is fairly low level, to the points where we were manually calculating projection matrices to display what would be 3 dimensional objects on our 2d screens. It was through this use of math and some user provided info we can display an Augmented View of someones income/savings.

Challenges we ran into

Unfortunately due to the restriction of the Android OS we needed to use fairly low level frameworks to develop an Augmented view. It was because of this constraint our group exceeded even our own expectations in knowledge gained and obstacles overcame.

Accomplishments that we're proud of

In under 24 hours we were able to build an augmented view. None of the members of our group had any experience in this topic and to look back at what we've accomplished over the past day is an achievement in itself.

What we learned

As previously stated, none of the members of our group had any real experience with augmented reality tool-kits and frameworks. We've learned a lot over the past 24 hours and we will most definitely use this experience for the better in the future.

What's next for Money Moves

Obviously a 24 hour time constraint isn't enough for everyone to accomplish every single one of the ideas they had at the beginning. With that being said there is room for expansion in asset selection and visualization of what your money means when quantified as everyday items. For example hamburgers, milkshakes, or even candy...
",https://github.com/westceno/MoneyMakesTheWorldGoRound,,Best Use of Immersive Technologies to Enable Consumer Financial Health (Fifth Third),"c#, unity, arcore, opengl",,Northern Kentucky University,2,801C-3,Northern Kentucky University,"","",""
