Gungho,https://revuc-x.devpost.com/submissions/209806-gungho,Submitted (Gallery/Visible),Pending,Submit,02/20/2021 21:32:06,"Inspiration

In this pandemic, a lot of people are working or studying from home, deprived from social interaction and physicals activities. This is a frightening situation especially for young people who are starting to feel isolated. In addition, it had been proven that doing special poses, like power poses or Yoga can improve mental health, physical health and self-esteem as well! That's why we've created Gungho.
Through Gungho we bring people together and in a safe way, just like they are in the same room!

What it does

Gungho, is a game where you invite people to try a series of human poses, in a group call, the person that imitates the pose the best is the winner. The series of challenges range from, pop poses, yoga poses, famous movies like Kung fu pandas and even Jackie Chan iconic martial arts poses etc !! It is a social multiplayer game powered by AI (tensorflow), that is all about having fun, socializing and staying physically active and mentally healthy.

How we built it

Our app is built on top of TenorflowJS using Posenet model and React JS for frontend. We used Web RTC for the video calls and socket.io to synchronize the score between the players.

Challenges we ran into

We faced problems optimizing the model and find a good balance between accuracy and speed.
We've also had some troubles managing complex components.We  also ran into trouble with collaboration as many of us were in drastically different time zones. Eventually, we saw this as an advantage as we were able to work 24 hours around the clock. It was also amazing to collaborate with people from different countries.

Accomplishments that we're proud of

We are proud of how much we accomplished during this time frame. We've learned about new tech stacks and all of us didn't even know how to build a working MVP before this! :)

What we learned

TenserflowJS, PeerJS and many tips of React.

What's next for Gungho

Enhance some functionalities, like comparing the pose with the player's pose, a ranking board that shows the best players and cool AR filters like hats, moustaches, skins for players !
",https://github.com/shannon-c/GungHo-,https://youtu.be/dt8GCl7n4Ms,"Best Education Hack, Best Design Hack, Most Useless Hack, Most Innovative Grad Hack (EECS-GSA), 1st Place Capture the Flag","tensorflow, react, webrtc, node.js, socket.io",,"Epsom College, National Institute of Technology, Tiruchirappalli",1,"",shannon-c and rakshaa2000
InvestX,https://revuc-x.devpost.com/submissions/209922-investx,Submitted (Gallery/Visible),Pending,Submit,02/20/2021 23:59:50,"Inspiration

With meme stocks taking over social media recently, many of millenials have jumped into the world of finance without having much investing experience. Millennials, as they care about making an impact, also want to know how they can invest sustainably. But as a first timer, they donâ€™t know where to start and which company they should invest in.

What it does

So thatâ€™s how we built InvestX, a platform that allows millenials to easily find and invest in companies based on the issue they care about. We aggregates realtime stock data along with articles about the impacts a company has on the world to determine the metrics score based on their preference.

So how does it work?


The user picks the impact that they want to focus on from a choice of broad impact(which supports ESG), or climate or social impact.
Then based on that preference, we find articles of each company relating to that preference and use machine learning to recommend top 5 stocks which are top performers in that impact category.
They choose the company and can find out more about how that company stacks up against others in various ESG dimensions.


Features


Dynamically updated chart with the latest stock data
All the latest market data and ESG stats for the the S&P500
Set your ESG preference on your profile
Pull articles for the company based on your ESG preference
Search for stocks across the market


ESG Dimensions


Environmental impact
Labor Practices
Social impact
Gender equality
Pay equality
Corporate activity impact
Public welfare score
Long term profitability
Short term profitability


How we built it


Nextjs/React = FE
Serverless functions w/ Next = Part of backend (firebase admin sdk)
TailwindCSS = Styling
Figma = Prototypes/Mockups/Designs
Firebase Auth = Authentication and Authorization (if we do group buy)
Firebase Firestore and Datastax = Central Database
Flask Backend = Central Backend
Selenium = Web Scraping
Yarn
Alpaca for Market data, not alpha vantage or polygon.io
Refinitiv and RapidAPI for ESG data
newsapi.org


Challenges we ran into


Alphavantage ratelimiting so had to use alpaca
Polygon.io free API is only limit 5
SearchAPI is only on alphavantage
New to NextJS
News API Rate limiting


Accomplishments that we're proud of

Best project we've got so far in hackaton, so proud of our team being able to finish all features in short amount of time (24 hours only).

What we learned

Learned a lot of new tech stacks

What's next for InvestX

Adding a trading function, impact categories, link to government entities that regulate environment data.
","https://github.com/jessehu312/investx, https://investx.tech/, https://investx.vercel.app/",https://youtu.be/iMJnRGgpMTk,"Best Domain Registered with Domain.com (MLH), Best use of Google Cloud (MLH), Best use of DataStax Astra (MLH), Best Education Hack, Best Design Hack, Most Creative Hack","nextjs, react, tailwindcss, firebase, datastax, flask, selenium, yarn, firestore, alpaca, newsapi",,"north china university of technology, University of Washington, Florida Institute of Technology-Melbourne",3,https://investx.tech,"prismnavy#5085 , Allegro145 #0583 , Aryan Vichare #8618 , muntaser #9731"
The recruitment game,https://revuc-x.devpost.com/submissions/209938-the-recruitment-game,Submitted (Gallery/Visible),Pending,Submit,02/21/2021 00:17:18,"The recruitment game

Recruitment is an art. Humans recruit humans/non-humans from the pool of information they have but has anyone connected with all the homo-sapiens around the world? Cicada 3301 was meant to recruit highly intelligent people through the dark-web. It was/is a collaborative effort from humans all around the globe to connect with people who wanted to work together to achieve a common goal, innovation! I care for each and everyone on this planet so I want to recruit everyone whether it's the dark web or the surface web. The recruitment game will help us connect with people, to understand people and the most important thing of all, it'll help people to understand how a person's mind works. 

History

This game started in 2013 when a group of like-minded people were having a cup of coffee and discussing advance recruitment techniques. There were engineers, researchers, and a human being which nobody knows. People call that person Cicada. They intended to connect with every human on the planet but the only thing common between that group was that they played games. They were all cryptographers in their ways so they started a game. I might have also played that game sometime in my life but it was not available publicly. This is an open-source game that will help us to achieve the goal which they intended to achieve. 

What it does

This is a scavenger hunt. It is a simple game but complex at the same time. A person can solve these clues using a computer or just a pen and paper. As you can see in the videos that I designed a game using a pencil so a human can easily solve it with a pencil or a computer but, it solely remains in the hands of the human which path they use because each path leads to a different destination. Everyone has started the journey from a different place but we will end it together! 

What's next for The recruitment game

This is a game which will keep on going until all the people interested are into it. A person will start the game and will get bored because they might be unable to reach the next clue but, each and every clue will be a hurdle or a step forward. This can turn into one of the world's largest open-source project where researchers from all over the world can contribute and help each other to achieve their goals. I started this game alone with the intention to connect people. Let's see what happens next. 
",https://hellokathan2.wordpress.com,https://youtu.be/1nITCfifMaY,"Best Education Hack, Best Design Hack, Most Creative Hack, Most Useless Hack, Most Innovative Grad Hack (EECS-GSA)","python, cryptography, angular.js",,University of Cincinnati,0,"",nightkpowl
GreenUP,https://revuc-x.devpost.com/submissions/210041-greenup,Submitted (Gallery/Visible),Pending,Submit,02/21/2021 02:03:44,"Inspiration

Everyone knows about the challenges that our planet is facing when it comes to the environment. This is why we would like to cultivate an eco-friendly culture among the general public in a fun and simple way. 

What it does

GreenUP will allow you to take a picture of an object and will suggest different fun and sustainable ways to reuse and recycle your object. You do a favor to Earth while having fun!

How we built it

We used Python for our backend and Google Cloud's Cloud Vision API to build an ML model that will detect the object on camera. For the front end, we used Flask.

Challenges we ran into

Knowing the right tools to use in the start of the project is always a hard task. We had to do a lot of research and ask questions before starting to code. Gathering a good dataset of different objects and ways to recycle them was also not easy. We did not know much about Google Cloud's API and Flask, so we had to do some research.

Accomplishments that we're proud of

We are just proud to be able to complete the project and come up with something that works and achieves good results.

What we learned

A LOT! From how to code in the backend, deploy the ML model, move to the front end.. We just learned a lot from this project and we are happy to have been able to complete it.

What's next for GreenUP

We would like to expand our dataset and include more objects and maybe new features that would make it better for the user.
",https://github.com/yahyaakli/spring2020hackathon,https://www.youtube.com/watch?fbclid=IwAR2Xldo4nmm7dOJVvaS0XDehDdaZ862sI9ojjuFgeuxojozWzEfK68nzi2M&v=ns7Jq-9SvEc&feature=youtu.be&ab_channel=yahyaakli,"Best use of Google Cloud (MLH), Best Design Hack, Most Creative Hack, Most Innovative Grad Hack (EECS-GSA)","python, google-cloud, flask",,University of Cincinnati,1,"","nabil.berjaoui, yahya.akli"
LazyKnow,https://revuc-x.devpost.com/submissions/210199-lazyknow,Submitted (Gallery/Visible),Pending,Submit,02/21/2021 04:52:58,"Inspiration

Sometimes, we needed to refer back to a lecture to review, or wished not to miss important lectures that we didn't have the ability to fully attend. Unfortunately, Zoom, and most video-conferencing services, only allow hosts and paying customers to record meetings. We thus created LazyKnow to help us avoid falling behind in class.

What it does

LazyKnow provides users the important information of a lecture through just a few simple clicks. You can indicate when you want LazyKnow to begin and finish storing content from your lecture. After your lecture is finished, you can choose to retrieve the full transcription of your lecture and/or automatically download AI-generated notes if you're reviewing in a rush.

How we built it

We built it using Python, tkinter, AssemblyAI, and the Bert Extractive Summarizer

Challenges we ran into

We had problems transcribing the audio due to compatibility and encoding issues with the audio files.

Accomplishments that we're proud of

We're proud of making a functional app through our combined efforts, and not giving up and ""subtly leaving the hackathon"" after experiencing severe technical difficulties for a few hours.

What we learned

We learned about the complexities of computer audio handling, how to create desktop applications, and the power of friendship.

What's next for LazyKnow

We hope to generate more sophisticated and attractive-looking notes for our users.
",https://github.com/bbrianzzhang/notetaker,https://youtu.be/4UDyJP76BWs,"Best Education Hack, Most Creative Hack","python, tkinter, assembly-ai",,"",1,"",senioritis#7240 Brian Zhang#9263
Detectia,https://revuc-x.devpost.com/submissions/210411-detectia,Submitted (Gallery/Visible),Pending,Submit,02/21/2021 08:06:44,"Inspiration

Recently a video popped in my recommendation, this was the video - link. This video caught my attention and I watched it to the end. It got my mind thinking, I browsed the Internet and came to know that a machine called a Polygraph can actually detect truths and lies using body vitals. After further research, I found there are web tools that can spot lies using facial and audio recognition, Soon I thought we could make a tool that detects a lie by the text provided, it seemed to be a great idea. So we started this project

What it does

This is a text-based lie detector. 
Users can input text/statements and submit them. Our neural network will analyze the statement and classify it as truth or lie based on these categories


No. of characters
No. of words
Avg. length of words
Readability score
Part of speech: Is this word an adjective, noun, something else
After analyzing it properly it would tell you whether it is truth or lie and the truth/lie percentage as well.
This tool can really help in spotting lies


How we built it

We used Flask and Python in the backend to create the web server. For detecting lies, we use a Neural network and NLP for our model. The model is trained on 200 rows of data by PolitiFacts, PolitiFacts is a website which provides facts and rates them as true or false. We have used CSS and vanilla JS for the frontend.

Challenges we ran into

We are both high schoolers and this project was a bit complex for us. Having limited experience in ML as well as neural networks we faced hurdles every minute. Using helps from open source platforms asking some friends and crash coursing things we made it through. But there were specific challenges that had us scared -


Data Scraping
Using NLP and Neural network (first timers)
Our teammates left in between which only left us two
Hosting it


Accomplishments that we're proud of

This hackathon was very competitive. Jostling through the competitive coding experience had us goosebumps.  During these 24 hours, we achieved many things which made us proud and boosted our self-esteem. The accomplishments we are most proud of -:


Completing this grand project in 24 hours
Building the neural network
Successfully data scraping over 800 rows (although we didn't use it at the end)
Training the Neural network (was a too tedious task)


What we learned

We are both high schoolers and this project was a bit complex for us. Having limited experience in ML. We learned the basics of ML,  expanded our knowledge of python, and learned about neural networks

What's next for Detectia

We will make it more accurate and provide reasons as well.
We will also add OCR (image to text) and Speech to the text which will make it more accessible
","https://detectia.herokuapp.com/, https://github.com/antriksh123/Detectia, https://detectia.tech",https://youtu.be/p9ZhpZxvdYY,"Best Domain Registered with Domain.com (MLH), Best Education Hack, Best Design Hack, Most Creative Hack, Most Useless Hack","python, machine-learning",,DLF Public School,2,https://detectia.tech/,yum#8922 Chief#7929
Chelper,https://revuc-x.devpost.com/submissions/210441-chelper,Submitted (Gallery/Visible),Pending,Submit,02/21/2021 08:27:54,"Inspiration

Some of our team members have been in online discord classes before. We noticed that, for teachers, Discord can be a bit complicated to learn with all those text channels, vocal channels, permissions, roles, etc. We think Discord could be a very good platform for online classes plus it's free! So, how about a bot that manages a class for the teacher?

Goal

Our goal is to centralize everything in one platform because online classes, most of the time, are split onto multiple platforms for assignments, classes, etc. Also, we want to add some security features to prevent student to cause chaos in the server

What it does

Right from the creation of the server, Chelper guides teachers through the configuration, there is almost no actions needed from the teacher. Here's what we implemented


When students will join the Discord, it will ask them for their student ID to verify them, rename them to their real name and assign them the right role to give them permissions to what they need. This way, no more Discord raid!
Teachers can give assignments with a due date and students will be able to submit their hard work directly to the bot, in his direct messages which will redirect it only to the teacher. 
Teachers are able to start online class at any moment, which opens the voice channel for the students to join


How we built it

We built it using Discord.py and we developped inside a poetry virtual environment. We also implemented a database connection, but we did not link it to the application due to lack of time. Also, to make it easier for our user, we made a beautiful pdf documentation 

Challenges we ran into

Message reaction events took a lot of time to put into place

Accomplishments that we're proud of

For the whole team, it is our first Discord bot and we think it's a pretty good start

What's next for Chelper

There's a lot of online class problems that we thought of, but in 24h we had to select the major ones. In the future, we could implement chat restrictions, moderation tools, ban chat words, anonymous questions.

Credits

All art work credits goes to Gael Abudarham


Instagram : @roundworkimage

","https://discord.com/api/oauth2/authorize?client_id=810221205554593852&permissions=8&scope=bot, https://github.com/AggroBane/Chelper, https://drive.google.com/file/d/1Y7tcqTIG1NqNucqjnnaC-NiTzO7JmFmU/view?usp=sharing",https://www.youtube.com/watch?v=kRZdfa6JB8M&feature=youtu.be&ab_channel=CodeMonke,"Best Education Hack, Most Creative Hack","discord.py, python, sql, poetry",,CÃ©gep Garneau,2,"","AggroBane#7712, eXo #9582, Hypstersaurus #6896"
Mastermind game,https://revuc-x.devpost.com/submissions/210505-mastermind-game,Submitted (Gallery/Visible),Pending,Submit,02/21/2021 09:02:43,"Inspiration

I started playing board games when I was young, and I still loving them. Now, with my new additions of skills in Computer Science, I am able to build these board games by code. I am also interested in creating bots that can navigate the game itself and solve it. 

The rule of Mastermind

If you already know it, you can skip for the next section
This is the game called Mastermind, a type of logical game between 2 players. One player comes up with a sequence of colors (in this program a sequence of digits, from 1 to 9), and the other player tries to solve it by making guesses. After each guess, the player with the code provides information about how closely matched the guess is compared with the actual code (element-wise comparison).  

There are three types of indicators: Green, which is an exact match of a digit (value and position in the code sequence); Yellow, which shows that digit exists in the code sequence; and Red, which shows that digit is not in the code sequence at all. 

What it does

The game has two parts. One part is for you, the player, to guess the number randomly generated by the system. The other part is the AI, in which you provide the test and see how many steps the AI takes to solve it. 

For the first part, the program randomly generates a sequence of 4 digits from 1 to 9. You then take turns to guess the digits. Whenever you press Enter, 1 turn counts. The results box shows how closely matched your answer is with the code sequence. The rules for the colors can be found in The rule of Mastermind above, in the second paragraph. Theoretically you have only 8 turns maximum to solve the digit. 

For the second part, the program asks you for a sequence. Then an AI attempts to solve that sequence using the knowledge it learns after each guess. Its guesses are shown in the box on the right of the program, and the final guess should match with the code you provide in the first place. 

How I built it

This project is very simple. The external modules needed to import for Python to run this program are only Numpy and Pygame. 

The project has three main classes (or files). The first class is the Mastermind() class, which is the game objevt. The second class is the MastermindAI() class, which is the AI object used to solve the game given the Mastermind() class for it. Finally, the MainGUI() connects all the objects together to create the GUI for this project. 

The concept behind the AI is also very simple. The first guess we make a random guess, and sees what the feedback is. The AI stores its knowledge in some variables. The self.known is a dictionary that maps the index of the sequence to its correct answer. The self.existed() is a set that records the possible values in the sequence. The self.cannot is a dictionary of sets that maps the index of the sequence to a set of values it cannot have. And the self.notexisted() is a set that contains the values the sequence is sure to not have. After each guess, these four variables are updated, and they are very robust that they can solve the sequence in usually 5 or 6 steps. 

The motivation of the design of this AI is from the Minesweeper problem set, in the Knowledge lecture by CS50 Introduction to AI course on EdX. 

Challenges I ran into

There are some obvious bugs in the program, like the digits get overriden if the user does not press Delete before, or the past guesses board does not have a scrolling function if there are more than nine guesses. I do not have time to cover everything, because I am still a beginner in code, and I work alone on this project. 

Accomplishments that I'm proud of

Of course my proudest is the work being able to run! This project is far from the much more complicated programs or websites or AI systems out there. But it is beginner friendly, yet it covers many important Python concepts, like event handling, inheritance, management of objects and data structures, ...

What I learned

This project allows me to practice using Pygame one more time, as well as giving me the time constraints to finish the project. 

What's next for Mastermind game

There are several ways to expand this game, such as allowing a user to define the range of digits (or numbers) for each element in the sequence, and the length of the sequence itself. Running the code for many randomly generated sequences, and providing plots to analyze the AI's performance is also very interesting. I can also try improving the bot by building optimalization code for it. Then finally, to publish it, I can build a simple website from Flask, then use the networking module in Python to build a Mastermind website that allows the players to log in and play each other. 
",https://github.com/Mustardburger/mastermind,https://www.youtube.com/watch?v=h9n0AfBhjIk&feature=youtu.be,"","python, pygame",,University of Cincinnati,0,"",Mustard
Coin Tosser,https://revuc-x.devpost.com/submissions/210526-coin-tosser,Submitted (Gallery/Visible),Pending,Submit,02/21/2021 09:12:53,"Inspiration

We are beginners. We wanted to win. So we decided to make a website that is not useful. Just to get a prize in Useless hack.

What it does

It gives the output as heads/tails upon clicking a button

How we built it

Using HTML, CSS, and Javascript.

Challenges we ran into

How to center button to the center of the page, How to show the result of the coin toss

Accomplishments that we're proud of

Learnt positioning of elements using CSS

What we learned

HTML, CSS and git
How to change background colour using animation.

What's next for Coin Tosser

Add more games or mini-games and convert the website to a 
",https://github.com/Irfan7014/RevolutionUC-2021,https://youtu.be/-mDizfWdxS8,Most Useless Hack,"html, css, javascript",,Fr. Conceicao Rodrigues College of Engineering,3,"",Irrffii  /  iwtga /  rachel-codead  /  aayushi
