Bananalyzer,https://revuc-x.devpost.com/submissions/210527-bananalyzer,Submitted (Gallery/Visible),Pending,Submit,02/21/2021 09:13:34,"Inspiration

With the pandemic causing people not to move as much, eating healthy is as important as ever. During this time, one of our group members tried eating more produce but had minimal knowledge on what was good and for how long. We realized a barrier was present for produce selection and healthy eating for inexperienced buyers.

What it does

Bananalzyer utilizes a web application to take pictures of produce to be analyzed. Then, image processing trained by a neural network uses the image to provide data on ripeness, freshness, and days until the item goes bad. The data is presented to the customer to inform them to make the best decision.

How we built it

We built the web app using Bootstrap, HTML, CSS, and Flask. Utilizing Github and VS code to work together on the project between the four people. Then to analyze the fruit we used image processing trained by a neural network. We used several different image processing techniques and algorithms. We utilized machine learning to help classify good and bad fruit.

Challenges we ran into

During the project, with 4 people working together we ran into coordination issues. Also, given no final solution sometimes ideas conflicted. When designing the website we had minimal front end development experience so designing and redesigning the website was a big challenge. 

Accomplishments that we're proud of

We are proud of developing an idea that will help the health of others by giving them access to more information to make better decisions. Team work was improved between the group during the process to improve efficiency through the event. Being able to submit a working application and being able to demo it effectively was a fulfilling achievement.

What we learned

We learned front end development and how to overcome the challenges involved with it. Also, we learned how to integrate the image processing into the web application to accomplish the intended functionality and make the idea come to life.

What's next for Bananalyzer

Unfortunately, due to time constraints, Bananalyzer could not meet all the functionality that was intended. Up next is incorporating more produce to chose from, improve the UI to make it easier to use, and provide more data on the produce. We plan on expanding our process by adding in questions related to the texture for the user to input after he/she has taken a picture of the produce. We understand there are other factors that go into the freshness of produce and will be working towards adding these factors to enhance the rating process. We also plan on improving the ""Bananalyze"" page by showing more detailed data as well as using charts so the consumer can visualize the data easier. This visualization is important so the customer can understand the important factors, freshness, ripeness, and how long the produce will last.
",https://github.com/32BenH/FruitParty,https://youtu.be/k-U78owcmII,"Best Domain Registered with Domain.com (MLH), Best Design Hack, Most Creative Hack, Most Useless Hack, Most Innovative Grad Hack (EECS-GSA), Making the Customer's Life Easier (84.51)","html, css, java, python, github, matlab",,University of Cincinnati,3,https://banalyzer.tech,"wije#8943, Leaxle#2933, Kwippy#5578"
Witty Bear,https://revuc-x.devpost.com/submissions/210591-witty-bear,Submitted (Gallery/Visible),Pending,Submit,02/21/2021 09:52:58,"Inspiration

What it does

Powered with ReactJS and Google Cloud, Witty Bear is a platform where not only you can attend the events but schedule the events as well. It's a perfect platform for the organizers and the attendees to coordinate.

How we built it

We developed a web application framework ""Witty Bear"" as a prototype of user interface which uses Google Cloud Firestore as back-end and ReactJS as front-end. Authentication and storage of information done through Google Cloud Firestore as well.

Challenges we ran into

We faced issues with the design of the frontend as we were trying to implement a great user experience. Connecting and fetching the data from the Google Cloud was also a bit challenging.

Accomplishments that we're proud of

The user interface of our web application is something we are proud of. We are now more familiar with Google Cloud. CRUD operations and query with Google Firestore are all the things that we'll list as our accomplishments.

What we learned

From the first commit on git to collaborating as a team, connecting Google Cloud and deploying the code on heroku, we have learned a lot.

What's next for Untitled

We are extremely excited about the web application and we are definitely going to work on it and take it to a position where it can actually help people.
","http://wittybear.herokuapp.com/, https://github.com/aman-malviya/revolutionuc",https://youtu.be/KU1QpdLSNmk,"Best use of Google Cloud (MLH), Best Education Hack, Best Design Hack","react, html5, css3, google-cloud, firestore, vscode, github, git",,"MANIT Bhopal, India",1,"",'@yash7091       @Aman Malviya
Hack It On!,"",Draft,Pending,Project overview,02/21/2021 10:01:17,"","",,"","",,Ivy Tech Community College of Indiana,0,"",""
Fluency,https://revuc-x.devpost.com/submissions/210625-fluency,Submitted (Gallery/Visible),Pending,Submit,02/21/2021 10:10:56,"Inspiration

Eloquent oration and strong communication are crucial skills to make sure one's point gets across, whether that be in interviews, presentations, or even every day conversation. Our team realized that there are countless self-improvement apps to help users quantify their fitness, knowledge, productivity, etc. but nothing for speaking. With all communication being virtual, it is ever more important to focus on the quality of our words, because that's one of the only ways for us to connect with each other. Everyone wants to be a better speaker, and the Fluency is designed to support the process of refining one's speech.

What it does

The Fluency is a lightweight app that will help analyze your communications. At any point, a user can choose to start or stop recording their audio. The audio file will then be securely transferred over to our back-end servers to analyze directly using ML models without any work on the user-end. Once the analysis is completed, users can see statistics such as their speaking rate, amount of unnecessary pauses, and other valuable, and sometimes unexpected data.

How we built it

The Fluency is an Electron App which makes API requests to a Google Cloud Platform Flask back-end. The libraries used to analyze the data is my-voice-analysis.

Challenges we ran into

None of our team had been familiar with how modern libraries work with audio files, and it turns out they are a lot more complicated than we'd imagined. Figuring out how to transfer these files back and forth from the client-side to the back-end was a headache as the configuration for how our app would record audio could only work on Windows machines.

The models that have been made for specifically the task of analyzing issues in speech are restricted in their functionality, and there are no robust technologies that have been produced for this task. Thus we had to hack together a few different libraries together to get the analysis that we wanted.

We initially were thinking of using simple serverless API calls from a simple chrome extension. However, the packages and programs we needed to set-up became very delicate and so we had to completely scrap and recreate our backend around halfway through, and the browser was often fickle with allowing us to record microphone audio.

Accomplishments that we're proud of

Despite the difficulties dealing with audio files, we managed to create an extremely streamlined back-end. The computation speed can be scaled up quite easily by adding more cores into the GCP Compute Engine, and we abided by REST standards.

What we learned

Although we had experience with Python and backend before, we had never used Flask. It was incredible to see libraries that seemed to constantly break down in deployment be so seamlessly integrated via Flask. While working with the Python ML, we also realized both how incredibly powerful ML is, as well as how incomplete these models currently are for speech analysis and a day-to-day user. 

When our ideas for making a Chrome extension broke down, we knew we had to find something equally as accessible. Mentors suggested Electron, and we decided to use that for the first-time to create a client-side interface. 

What's next for Fluency

There are so many possibilities ahead now that we have settled the back-end infrastructure and audio data transfer. It is now far more feasible to iterate on our ideas and expand the types of models that we are using for the audio analysis. Different models allow for different analyses, and depending on which features users want to see, we can pick and choose models to implement. 

Part of the hopes with the project as a Chrome Extension was for integration with Google Meets or Messenger Calls for ease of use whenever entering a meeting. As an isolated Electron App, we now have the opportunity of integrating with Zoom, Skype, and other video/audio calling platforms.

We want to give users a very comfortable, accessible, but also productive experience, so we want to implement visualizations of the data and trends across time so that users can have a better idea of how to improve.
",https://github.com/joshuanianji/um-detector,https://youtu.be/De7u6KFPyNo,"Best use of Google Cloud (MLH), Best Education Hack","javascript, html, firebase, electron, flask, python, machine-learning, natural-language-processing, google-cloud",,University of Alberta,3,"","calvin, OshuaJay, RubberNoodles, ProbablyNotWorking"
Crash Buddy,https://revuc-x.devpost.com/submissions/210630-crash-buddy,Submitted (Gallery/Visible),Pending,Submit,02/21/2021 10:13:18,"Inspiration

Motorcycles are by their nature far less crashworthy than closed vehicles. They are also less visible to other drivers and pedestrians and less stable than four-wheel vehicles. Operating a motorcycle requires a different combination of physical and mental skills than those used in driving four-wheel vehicles. Motorcyclists and their passengers are more vulnerable to the hazards of weather and road conditions than drivers in closed vehicles.

In 2018, 4,985 motorcyclists died in motorcycle crashes and 857 bicyclists were killed in traffic crashes in the United States. Crash Buddy is a simple solution to this problem. It updates the website with the pre-crash data of a vehicle and also the position of the crashed vehicle. The amount of death and loss due to accidents is immense, especially for the victims who could be saved but weren't due to the lack of available communications with the medical support system. With this and a few close calls ourselves we came up with this project.

What it does

We have embedded piezo-sensors, an accelerometer, a GPS module and NodeMCU into a motorcycle jacket. When the driver meets with an accident(whether they are hit or fall down), the piezo-sensors are activated which in turn activates the GPS module which then relays the location of the rider to Google Firebase and displays the location on a website for easy access by the Emergency services.

How we built it

We used a few piezo sensors strategically placed at places that would feel the pressure after being hit during an accident, a neo-6m GPS module and a NodeMCU.

Challenges we ran into

The GPS module took some time to get up and running.

Accomplishments that we're proud of

Integrating hardware, GPS services, a website and a cloud to create an exciting and helpful project!

What we learned

Always reset your NodeMCU before uploading new code otherwise you will waste a lot of time compiling and running the right code and getting wrong results.

What's next for Crash Buddy

To deploy the website in real life for Emergency services and increase accuracy of GPS module.
","https://github.com/atharwa-24/Crash-Buddy, https://crash-buddy.netlify.app",https://youtu.be/s_BeUUfpEvY,"Best use of Google Cloud (MLH), Best Hardware Hack Sponsored by Digi-Key (MLH), Best Design Hack, Most Creative Hack","nodemcu, neo6mgps, accelerometer, piezo-sensor, html5, css, javascript, bootstrap, google-maps, firebase",,"VIT, Pune, Vishwakarma Institute of Technology , savitribai phule university, pune university ",3,"","PeePeePooPoo#0661, Atharwa_Kharkar#1002, sastadante#2016, Tejas_Khairnar#8735"
Leafy,https://revuc-x.devpost.com/submissions/210640-leafy,Submitted (Gallery/Visible),Pending,Submit,02/21/2021 10:20:25,"Inspiration

My major source of motivation for leafy was an incident that took place recently. My mother and her friends are very enthusiastic about botany. My house has a big garden with innumerable plants. She usually spends a lot of her time catering to all their needs. Once my neighbourâ€™s plant recently caught a infectious plant disease which was left undiagnosed. Due to this, the disease got communicated to our plants leading to their gradual death. Being nature lovers, it was a very traumatic experience for all of us. It made me wonder about the huge losses that the agriculture sector incurs because of the lack of right awareness at the right time. This prompted me to prepare a mobile application to prevent its reoccurrence.

What it does

The android app takes a leaf image from mobile gallery. App is connected via API to python backend which uses a well trained CNN based model which is trained by dataset comprising of over 30000 plant images. It can accurately predict and classify leaf diseases to a degree of 94%. If the model finds the detected disease to be infectious, it notifies all the nearby mobile phones(in radius < 2 km) to take precautions to prevent the disease.

How we built it

CNN model using Tensorflow, Scikit-learn, and OpenCV
App using android studio
API using flask(python)
and around 5 cups of coffee â˜•ï¸ 

Challenges we ran into

I used my knowledge of java, python and html with a bit of css. Building a CNN model which could private the highest level of accuracy and F1 score was the main challenge. Another challenge was trying and testing the perfect combination of the CNN model parameters achieved desired results.

Accomplishments that we're proud of

Through the course of this hackathon, I learnt the use of Google cloud AI notebooks which will go a long way in helping us become better hackers. The fact that we were able to document our imagination and ideas into code successfully and complete this project in time is probably a big accomplishment for both of us. 

What's next for Leafy

With the use of Drone, I look forward to map acres of land to help the farm owners. Also, I can extend and develop another model which would be able to analyse soil through photos and predict about any lack of nutrients.
","",https://youtu.be/8koEKykNoLA,"Best use of Google Cloud (MLH), Best Design Hack, Most Creative Hack, Most Innovative Grad Hack (EECS-GSA), 1st Place Capture the Flag, Making the Customer's Life Easier (84.51)","tensorflow, python, java, android",,University of Massachusetts Amherst,0,"",mst#1470
Hack it On!,https://revuc-x.devpost.com/submissions/210643-hack-it-on,Submitted (Gallery/Visible),Pending,Submit,02/21/2021 10:21:25,"Inspiration

This project was pretty heavily inspired by games in the Jackbox series, as well as some past projects we've worked on. We decided we want to try for a retro-theme game, and ended up theming it around hacking.

What it does

In Hack It On, all players are grouped on a team and tasked with completing specific tasks such as debugging a program, entering in passwords, and reading out said passwords for people to achieve the ultimate goal of earning enough points to hack into the mainframe. What's the mainframe? We're not quite sure yet.

How we built it

Hack It On was originally served through Django, with the majority of it is written in NodeJS. Communication between the client and the server is handled through Socket.IO. Issues with deploying the Django server forced us to switch to NodeJS for serving last minute.

Challenges we ran into

The biggest challenges we ran into were not logical ones, but just the time constraint and random JavaScript irregularities. Eventually, though, we made the most of our time and solved all the random errors.
Also, Domain.com had trouble with our user account. We did purchase the domain hacking-it.online.
","https://github.com/drewgifford/HackItOn, http://hackiton.drewgifford.com",https://youtu.be/AiZFkZn_OO0,"Best Domain Registered with Domain.com (MLH), Best Design Hack, Most Creative Hack","node.js, django, html5, css3, javascript, socket.io",,"University of Cincinnati, Ivy Tech Community College of Indiana",1,http://hacking-it.online,"Toadally#0001, Jared#5984"
Seek Out Local,https://revuc-x.devpost.com/submissions/210660-seek-out-local,Submitted (Gallery/Visible),Pending,Submit,02/21/2021 10:33:51,"Inspiration

The pandemic has impacted many local businesses to cut costs with staff, hours, or shutting down the business as a whole. Local and independent businesses need new and lasting customers to make a comeback and to continue expressing their passion for their products. Consumers are transitioning from passive to active consumerism. This is from people spending time at home and realizing the surrounding items should be of good quality and evoke positive emotion. People are choosing quality and price over commodity and convenience. This app will connect consumers with unique, lasting, neighborhood businesses.

What it does

Ideally, the app would be able to connect with the consumers history of purchases from supermarkets such as Kroger, Target, or Walmart. The program would recognize the repeated items and define the item to begin searching for a match from a local business. The information from the local businesses would be drawn from their online shops to provide accurate pricing and content. The ""matched"" item would appear for the user for them to compare and decide to buy commodity or to buy local. The user would be able to see their proximity to the store location using GPS. However, if the person were not looking for food but rather gifts, Etsy.com would be presented to highlight artists in proximity. Navigating to a businesses webpage for purchasing items removes any payment security requirement of the app. Overall, the app encourages the user to buy from local businesses by presenting the organized information   accurately. 

How I built it

I built the user-interface portion using Adobe Xd. I begin with a loading screen as the app were to start up. Then the main screen includes a search bar and the products. From there, I was able to draw paths between screens to show the movement between product images to business websites. 

Challenges I ran into

One challenge was not having any back-end development to know if the idea would be applicable. This did not halt my work as my main goal was to visualize the product and to learn new software!

Accomplishments that I'm proud of

I'm proud of completing my first hackathon! I had a great time getting to meet people, learning Adobe Xd, and being able to create and design a visual and interactive project. 

What I learned

I learned an entirely new software to create and manipulate images. I appreciate having an aesthetic outlet and still being able to solve a problem. 

What's next for Seek Out Local

The next step is to begin the back-end development. Another addition could be to compare the users expenditures with supermarket vs. local/independent businesses with user-interface.
","",https://youtu.be/uMGnGqi7TjI,"Best Design Hack, Making the Customer's Life Easier (84.51)",adobe,,University of Cincinnati,0,"",lran#9157
Fruit Fun Pico-8 Game,https://revuc-x.devpost.com/submissions/210663-fruit-fun-pico-8-game,Submitted (Gallery/Visible),Pending,Submit,02/21/2021 10:34:47,"Inspiration

I really enjoy playing platform and retro games such as Celeste and I thought it would be fun to learn how to make one myself!

What it does

I built a simple platformer game in which you are a cat who has to jump around and catch fruit falling from the sky. You win the game when you reach 50 points!

How I built it

I built this game using Pico-8, a game making software that runs on a modified version of the Lua language. For the first half of the hackathon I used tutorials to learn the basics of Pico-8 and afterward created my game.

Challenges I ran into
One of the biggest challenges that I ran into was creating the main menu screen and win screen. Because I made them after the game and movement, I had to almost completely move around all my code to make a ""state machine"" or something that would allow me to shift between the main menu, win screen, and game state. There were several scary moments where I went to test the game and nothing happened, but I managed to fix it in the end!

Accomplishments that I'm proud of
I'm proud of myself for making a fully functional game from scratch! I am also proud of myself for submitting my first ever hackathon project!

What I learned
The basics of Pico-8 and Lua
The basics of game development
How hard 8x8 pixel art is and how frustrating collisions can be

What's next for Fruit Fun Pico-8 Game
Something that I wanted to add at the very beginning of the project was a character select option. I want to make it so that once you achieve certain milestones (like collected 100 fruit or won 3 times) you could unlock new characters to play with such as a dog, panda, llama, etc.
I also wanted to add a stage select option where players could select a different environment to play in. However, these goals first require me learning how to create selection options in Pico-8!
",https://github.com/SaadKhan090/Fruit-Fun,https://www.youtube.com/watch?v=on8iok4Pg6U,"Most Creative Hack, Most Useless Hack","pico-8, lua",,"",0,"",Pixelated_Polygon
Spaceship Escape Room,https://revuc-x.devpost.com/submissions/210664-spaceship-escape-room,Submitted (Gallery/Visible),Pending,Submit,02/21/2021 10:35:02,"Inspiration

One of my hobbies that I miss most during the pandemic is going to Escape Rooms with my friends! This project was inspired by those rooms, and the social problem-solving fun that comes along with them!

What it does

Gameplay

This project is an online multiplayer Unity3D game where players work together to stabilize their spaceship which has been damaged by asteroids. Users have a very limited amount of time to fix the ship before they run out of oxygen, and have to use problem-solving skills and teamwork to make sure they succeed!

Technology Stack

The code behind this project is supported heavily by the Mirror Networking library alongside the Chykary/FizzySteamworks git repo. These technologies allow players to connect to each others' easily & without port forwarding, with the only requirement being that they have an instance of Steam running on their machine!

Assets

Many art and sound assets were made for this project! While most of the in-game map is made using the Unity Probuilder library, nearly every not-floor-or-wall 3D asset was made by Jake using Blender! The music for the game was all made by Kevin within the duration of the hackathon, as well as many of the sound effects!

Challenges we ran into

I (Sam) am very new to realtime multiplayer networked game development - more than a month ago, I'd never heard of the Mirror networking library! Early on in the project, I spent something around 30 minutes debugging a connection issue, which turned out to be a typo we made during runtime when connecting to a session!

Another issue I ran into - at something like 4am, I had an issue where Unity said I was missing the Steamworks libraries. They were in my asset folder and everything, but I couldn't get rid of the compiler error! I spent over an hour debugging the issue before I tried re-cloning my project, which did the trick!

Accomplishments that we're proud of

We're all extremely happy about how the game feels to play! The ambience between the models and the SFX and the snappy gameplay makes for a very enjoyable time, which we're able to easily share with our friends thanks to the Steam Networking features we included!

What we learned

I (Sam) learned a ton about networked game devlopment! I'm currently taking a computer networking course, in which we've briefly discussed things like server commands and Rpc's, and this project has given me a much greater understanding of the strength of those tools.

What's next for Spaceship Escape Room

After a long night's sleep, and a bit of catching up with homework, I plan on sharing this game with my friends so I can see what they think!
",https://github.com/swiimii/space-escape-room/releases/tag/v0.1,https://youtu.be/aPVLR89Az4E,"Best Design Hack, Most Creative Hack","unity, blender, ableton, c#",,University of Cincinnati,2,"","""Sam 2#3895"", ""CoolUncle420#7978"", ""BrokenGlass (Jake)#2213"""
